{
  "schema_version": 1,
  "meeting_id": "2026-05-08__test-meeting",
  "title": "Тестовая встреча по замечаниям документации",
  "date": "2026-05-08",
  "start_time": "10:17:18+03:00",
  "participants": [],
  "source": {
    "kind": "offline_record",
    "original_location": "Локальная запись пользователя; абсолютный путь не коммитится.",
    "media_files": [
      {
        "path": "source/2026-05-07 10-17-18.mp4",
        "media_type": "screen_recording"
      }
    ],
    "audio_tracks": [
      "MIC",
      "SYS"
    ],
    "derived_tracks": [
      "MIX"
    ],
    "notes": "Тестовая запись с выступающим, документацией и замечаниями, пересекающимися с ФТТ, Паспортом ИС и ЦТА."
  },
  "processing_status": "new",
  "artifacts": {},
  "classification": {},
  "links": {},
  "retention": {
    "policy": "protected",
    "reason": "Запись содержит демонстрацию проектной документации."
  },
  "rag": {
    "index_policy": "structured_artifacts_and_final_transcript",
    "indexed_artifacts": [],
    "no_index_artifacts": [
      "source/2026-05-07 10-17-18.mp4"
    ]
  },
  "created_at": "2026-05-08T00:00:00+03:00",
  "updated_at": "2026-05-08T00:00:00+03:00"
}
